{
  "overall": -0.06201720419978641,
  "pds": 0.021574873999181662,
  "expression_accuracy": 0,
  "de_lfc_accuracy": -0.00616895244290816,
  "de_direction_fidelity": -0.3488159182872658,
  "de_direction_reach": -0.0028642422192566817,
  "de_significance_overlap": -0.03582898624846944,
  "partition": "val",
  "panel": "vcc2026-val-1",
  "anchor_set": "vcc2026-valA-r4+vcc2026-valB-r4+vcc2026-valC-r4",
  "entry_id": "zYdT8klGWw8UXg3r8KJx",
  "model_name": "virtual-cell-generalization baseline v1",
  "scored_utc": "2026-09-26T03:40:47.080101Z",
  "vcc_package_sha256": "16a5b17c429582d2c93dc94356cf350d815eb62f8881097aad6441f5a0390910",
  "raw_status_json": {
    "entry_id": "zYdT8klGWw8UXg3r8KJx",
    "status": "published",
    "model_name": "virtual-cell-generalization baseline v1",
    "description": null,
    "is_final": false,
    "submission_date": "2026-09-26T03:40:47.080101Z",
    "error_info": null,
    "rank": 883,
    "score_avg": -0.06201720419978641,
    "de_score": null,
    "pert_score": null,
    "mae_score": null,
    "pds_cosine": 0.5096246748420662,
    "expr_mse_unbiased_capped_norm": 1.0830620000794913,
    "de_wilcoxon_lfc_nmae": 1.0046734582615664,
    "de_wilcoxon_direction_fidelity_yield_raw": 0.40744347786202384,
    "de_wilcoxon_direction_reach_raw": 0.0765433858934929,
    "de_wilcoxon_sig_jaccard": 0.01713687179566378,
    "score_pds": 0.021574873999181662,
    "score_mse": 0,
    "score_nmae": -0.00616895244290816,
    "score_fid": -0.3488159182872658,
    "score_reach": -0.0028642422192566817,
    "score_jac": -0.03582898624846944,
    "partition": "val",
    "panel_id": "vcc2026-val-1",
    "anchor_version": "vcc2026-valA-r4+vcc2026-valB-r4+vcc2026-valC-r4",
    "is_terminal": true
  }
}
